{
	"id": "driver:automation",
	"type": "driver",
	"name": "Enable Agent-Ready Automation",
	"description": "Make models directly consumable by reasoning tools and agents: graph mapping, validators, and machine-readable constraints.",
	"version": "1.0.0",
	"status": "proposed",
	"attributes": { "automation_ready": true },
	"relations": ["driver:root"],
	"audit_history": [{ "event": "created", "by": "JEleniel", "event_time": "2025-12-09T00:00:00Z" }],
	"provenance": { "source": "project definition", "owner": "JEleniel", "version": "1.0" },
	"metadata": { "format": "aurora-card-v1", "serialization": ["json"] }
}
